{
  "schemaVersion": 1,
  "id": "project_reading",
  "displayName": "Project Reading",
  "runtimeMode": "component-controller",
  "runtimeContract": "unified-lifecycle-v3",
  "traits": ["tunnel", "diagnostic-ui"],
  "contractScript": "scripts\\runtime-control.ps1",
  "capabilities": [
    "ensure_running",
    "repair_connectivity",
    "restart_core",
    "reload_runtime",
    "shutdown_runtime",
    "show_diagnostic_tray"
  ],
  "lifecycle": {
    "controller": {
      "kind": "powershell",
      "path": "scripts\\runtime-control.ps1"
    },
    "diagnosticLauncher": {
      "kind": "vbs",
      "path": "scripts\\show-diagnostic-tray.vbs"
    }
  },
  "legacyStartup": {
    "shortcutName": "GPT Workspace MCP.lnk",
    "launcher": "scripts\\start-tray.vbs"
  },
  "probes": [
    {
      "id": "mcp",
      "label": "MCP server",
      "role": "core",
      "kind": "json",
      "url": "http://127.0.0.1:8787/health",
      "port": 8787,
      "required": true,
      "expected": { "ok": true, "service": "gpt-project-workspace-mcp" },
      "publicSummaryFields": ["service"],
      "ownership": {
        "commandContains": ["project_reading", "dist\\src\\http-main.js"]
      }
    },
    {
      "id": "tunnel",
      "label": "Secure MCP Tunnel",
      "role": "connectivity",
      "kind": "text",
      "url": "http://127.0.0.1:8788/readyz",
      "port": 8788,
      "required": true,
      "expectedText": ["ready", "ok"],
      "ownership": {
        "commandContains": ["project_reading", "tunnel-client"]
      }
    }
  ],
  "navigation": [
    {
      "id": "health",
      "label": "Open health",
      "kind": "probe",
      "target": "mcp"
    }
  ],
  "ui": {
    "menuContract": "component-menu-v1",
    "actionEntrypoint": { "kind": "powershell", "path": "scripts\\control-center-ui.ps1" },
    "menuActions": [
      { "id": "copy_mcp_url", "label": "Copy MCP URL", "group": "connection", "confirmation": "none" },
      { "id": "copy_health_url", "label": "Copy health URL", "group": "connection", "confirmation": "none" },
      { "id": "copy_tunnel_id", "label": "Copy tunnel ID", "group": "connection", "confirmation": "none" },
      { "id": "open_mcp_health", "label": "Open MCP health", "group": "connection", "confirmation": "none" },
      { "id": "open_tunnel_ui", "label": "Open tunnel UI", "group": "connection", "confirmation": "none" },
      { "id": "open_runtime_logs", "label": "Open runtime logs", "group": "connection", "confirmation": "none" }
    ]
  },
  "safety": {
    "managerDomainDataAccess": "none",
    "managerSecretAccess": "none",
    "shutdownConfirmation": "required"
  }
}
